Name,Image Link,Movie Watch link,Description,IMDB Ratings,Rotten Tomatoes Ratings,cast,Timeline,Categories,Language
the-broken-hearts-gallery,https://www1.123moviesto.to//123movies/the-broken-hearts-gallery.jpg,https://vidcloud9.com/streaming.php?id=MzI4NjQ1&title=The Broken Hearts Gallery,After a break up a young woman decides to start a gallery where people can leave trinkets from past relationships , , ,cast :,timeline : ,Action,English
cuties,https://www1.123moviesto.to//123movies/cuties.jpg,https://vidcloud9.com/streaming.php?id=MzI4NDU3&title=Cuties,Amy an 11-year-old girl joins a group of dancers named "the cuties" at school and rapidly grows aware of her burgeoning femininity - upsetting her mother and her values in the process , , ,cast :,timeline : ,Action,English
love-guaranteed,https://www1.123moviesto.to//123movies/love-guaranteed.jpg,https://vidcloud9.com/streaming.php?id=MzI4MTU0&title=Love, Guaranteed,To save her small law firm earnest lawyer Susan takes a high-paying case from Nick a charming new client who wants to sue a dating website that guarantees love But as the case heats up so do Susan and Nicks feelings for each other , , ,cast :,timeline : ,Action,English
unknown-origins,https://www1.123moviesto.to//123movies/unknown-origins.jpg,https://vidcloud9.com/streaming.php?id=MzI4MDg3&title=Unknown Origins,Madrid 2019 A serial killer is spreading chaos Anonymous people with no apparent connection are being murdered while imitating the first appearances of the most famous superheroes , , ,cast :,timeline : ,Action,English
bill-ted-face-the-music,https://www1.123moviesto.to//123movies/bill-ted-face-the-music.jpg,https://vidcloud9.com/streaming.php?id=MzI3NzYy&title=Bill & Ted Face the Music,Once told theyd save the universe during a time-traveling adventure 2 would-be rockers from San Dimas California find themselves as middle-aged dads still trying to crank out a hit song and fulfill their destiny , , ,cast :,timeline : ,Action,English
the-war-with-grandpa,https://www1.123moviesto.to//123movies/the-war-with-grandpa.jpg,https://vidcloud9.com/streaming.php?id=MzI3NzU3&title=The War with Grandpa,Upset that he has to share the room he loves with his grandfather Peter decides to declare war in an attempt to get it back , , ,cast :,timeline : ,Action,English
the-one-and-only-ivan,https://www1.123moviesto.to//123movies/the-one-and-only-ivan.jpg,https://vidcloud9.com/streaming.php?id=MzI3MjUy&title=The One and Only Ivan,A gorilla named Ivan tries to piece together his past with the help of an elephant named Stella as they hatch a plan to escape from captivity , , ,cast :,timeline : ,Action,English
the-sleepover,https://www1.123moviesto.to//123movies/the-sleepover.jpg,https://vidcloud9.com/streaming.php?id=MzI3MjM0&title=The Sleepover,When two siblings discover their seemingly normal mom is a former thief in witness protection who has been forced to pull one last job they team up to rescue her over the course of an action-packed night , , ,cast :,timeline : ,Action,English
work-it,https://www1.123moviesto.to//123movies/work-it.jpg,https://vidcloud9.com/streaming.php?id=MzI1NTA0&title=Work It,When Quinn Ackermans admission to the college of her dreams depends on her performance at a dance competition she forms a ragtag group of dancers to take on the best squad in schoolnow she just needs to learn how to dance , , ,cast :,timeline : ,Action,English
the-kissing-booth-2,https://www1.123moviesto.to//123movies/the-kissing-booth-2.jpg,https://vidcloud9.com/streaming.php?id=MzIzOTI3&title=The Kissing Booth 2,In the sequel to 2018s THE KISSING BOOTH high school senior Elle juggles a long-distance relationship with her dreamy boyfriend Noah college applications and a new friendship with a handsome classmate that could change everything , , ,cast :,timeline : ,Action,English
palm-springs,https://www1.123moviesto.to//123movies/palm-springs.jpg,https://vidcloud9.com/streaming.php?id=MzIyNTg1&title=Palm Springs,When carefree Nyles and reluctant maid of honor Sarah have a chance encounter at a Palm Springs wedding things get complicated as they are unable to escape the venue themselves or each other , , ,cast :,timeline : ,Action,English