Name,Image Link,Movie Watch link,Description,IMDB Ratings,Rotten Tomatoes Ratings,cast,Timeline,Categories,Language
humanitarian-the-real-michael-jackson,https://www1.123moviesto.to//123movies/humanitarian-the-real-michael-jackson.jpg,https://vidcloud9.com/streaming.php?id=MzE5NDMw&title=Humanitarian: The Real Michael Jackson ,So much has been written about Michael Jackson The majority of it manufactured twisted and just down-right untrue Until NOW - In the year 2000 Michael Jackson was listed into the  , , ,cast :,timeline : ,Action,English
pretty-little-dead-girl,https://www1.123moviesto.to//123movies/pretty-little-dead-girl.jpg,https://vidcloud.icu/streaming.php?id=MTE2NjE2&title=Pretty Little Dead Girl,Emma the lucky recipient of a recent heart transplant sets out to find the identity of her donor only to learn that it was her estranged cousin and may have been the victim of murder , , ,cast :,timeline : ,Action,English
campus-caller,https://www1.123moviesto.to//123movies/campus-caller.jpg,https://vidcloud.icu/streaming.php?id=MTEzNTQ2&title=Campus Caller,When a university student goes missing her mother a former cop goes in search for her What she encounters is a wall of academia bureaucracy and coverups that point to an abuse of authority stemming all the way to the government , , ,cast :,timeline : ,Action,English
broken-mile,https://www1.123moviesto.to//123movies/broken-mile.jpg,https://vidcloud.icu/streaming.php?id=MTA0Njg5&title=Broken Mile,A drug addict awakens to find the girl he is with is dead and must rush to escape the consequences A real-time thriller presented in a single unbroken take , , ,cast :,timeline : ,Action,English
the-case-for-christ,https://www1.123moviesto.to//123movies/the-case-for-christ.jpg,https://vidcloud.icu/streaming.php?id=MTAxMTk5&title=The Case for Christ,An investigative journalist and self-proclaimed atheist sets out to disprove the existence of God after his wife becomes a Christian , , ,cast :,timeline : ,Action,English